{
  "contract_version": 1,
  "name": "repeat cancellation while a task is cancelling",
  "request": {
    "method": "DELETE",
    "path": "/tasks/:active"
  },
  "response": {
    "status": 202,
    "body": {
      "contract_version": 1,
      "session_status": "busy",
      "task_status": "cancelling"
    }
  }
}
